{"$schema":"ai/schemas/verification-leaf-result.schema.json","$id":"ai/work-logs/issue-20/phase2c/review-gate-leaf.json","schemaVersion":1,"checkId":"review-gate","result":"PASS","taskKey":"level-5-runtime-verification","gateInvocationId":"level5-completion-gate-01","commitSha":"d5ed386a3f35b717f3d3c971d13c3148a7efe7f9","policySha256":"0192c4853f72183f9dffee972098b8fd8aec11dae8a7af31708f22136a6b1c94","producerId":"review-gate","producedAt":"2026-07-16T10:14:00Z","expiresAt":"2026-07-16T10:18:00Z","evidence":{"ref":".ai-runs/verify-20260716-level5-completion-build-01/gate-results/pre-done-claim.json","schema":"ai/schemas/gateway-result.schema.json","sha256":"6d86c2b1687abf030a7ec3bcf6fb499f26603d6c371efa5dd216da28d3a212c1"},"reason":null}
