{"$schema":"ai/schemas/verification-leaf-result.schema.json","$id":"ai/work-logs/issue-20/phase2c/verify-api-smoke-leaf.json","schemaVersion":1,"checkId":"verify.api-smoke","result":"PASS","taskKey":"level-5-runtime-verification","gateInvocationId":"level5-completion-gate-01","commitSha":"d5ed386a3f35b717f3d3c971d13c3148a7efe7f9","policySha256":"0192c4853f72183f9dffee972098b8fd8aec11dae8a7af31708f22136a6b1c94","producerId":"verify.api-smoke","producedAt":"2026-07-16T10:14:00Z","expiresAt":"2026-07-16T10:18:00Z","evidence":{"ref":".ai-runs/verify-20260716-level5-completion-api-smoke-01/commands/verify.api-smoke/44a4b537-95aa-47d0-8dac-4595af33e716.json","schema":"ai/schemas/command-result.schema.json","sha256":"29d3a0fc670ca17c45e9f067abfcf9167f20c13a8dc5c45336bdeb059e41fdc0"},"reason":null}
