{"$schema":"ai/schemas/verification-leaf-result.schema.json","$id":"ai/work-logs/no-issue/level-5-runtime-verification/phase2c/verify-integration-leaf.json","schemaVersion":1,"checkId":"verify.integration","result":"PASS","taskKey":"level-5-runtime-verification","gateInvocationId":"level5-completion-gate-01","commitSha":"d5ed386a3f35b717f3d3c971d13c3148a7efe7f9","policySha256":"0192c4853f72183f9dffee972098b8fd8aec11dae8a7af31708f22136a6b1c94","producerId":"verify.integration","producedAt":"2026-07-16T10:14:00Z","expiresAt":"2026-07-16T10:18:00Z","evidence":{"ref":".ai-runs/verify-20260716-level5-completion-integration-01/commands/verify.integration/f770b516-e628-44a6-997c-86624b138525.json","schema":"ai/schemas/command-result.schema.json","sha256":"951bbf4dbad8fdee13598c7494eb6fb9511c919e3920dac3c829751ae0a40503"},"reason":null}
