{"$schema":"ai/schemas/verification-leaf-result.schema.json","$id":"ai/work-logs/no-issue/level-5-runtime-verification/phase2c/verify-unit-leaf.json","schemaVersion":1,"checkId":"verify.unit","result":"PASS","taskKey":"level-5-runtime-verification","gateInvocationId":"level5-completion-gate-01","commitSha":"d5ed386a3f35b717f3d3c971d13c3148a7efe7f9","policySha256":"0192c4853f72183f9dffee972098b8fd8aec11dae8a7af31708f22136a6b1c94","producerId":"verify.unit","producedAt":"2026-07-16T10:14:00Z","expiresAt":"2026-07-16T10:18:00Z","evidence":{"ref":".ai-runs/verify-20260716-level5-completion-unit-01/commands/verify.unit/b5979ebd-edb9-4690-b276-e5f63d08ade2.json","schema":"ai/schemas/command-result.schema.json","sha256":"162a9a7d0ae15134c730a294793ec5edd1c493bf485d1c1b94b71c0612a6e33d"},"reason":null}
