{"$schema":"ai/schemas/verification-leaf-result.schema.json","$id":"ai/work-logs/no-issue/level-5-runtime-verification/phase2c/done-claim-gate-leaf.json","schemaVersion":1,"checkId":"done-claim-gate","result":"PASS","taskKey":"level-5-runtime-verification","gateInvocationId":"level5-completion-gate-01","commitSha":"d5ed386a3f35b717f3d3c971d13c3148a7efe7f9","policySha256":"0192c4853f72183f9dffee972098b8fd8aec11dae8a7af31708f22136a6b1c94","producerId":"done-claim-gate","producedAt":"2026-07-16T10:14:00Z","expiresAt":"2026-07-16T10:18:00Z","evidence":{"ref":".ai-runs/verify-20260716-level5-completion-e2e-01/gate-results/pre-done-claim.json","schema":"ai/schemas/gateway-result.schema.json","sha256":"3a33043222a928a354640ca47ed82e37ee8496f81d19f5ec21053c5bd007d8ee"},"reason":null}
