{"$schema":"ai/schemas/verification-leaf-result.schema.json","$id":"ai/work-logs/issue-20/phase2c/verify-e2e-leaf.json","schemaVersion":1,"checkId":"verify.e2e","result":"PASS","taskKey":"level-5-runtime-verification","gateInvocationId":"level5-completion-gate-01","commitSha":"d5ed386a3f35b717f3d3c971d13c3148a7efe7f9","policySha256":"0192c4853f72183f9dffee972098b8fd8aec11dae8a7af31708f22136a6b1c94","producerId":"verify.e2e","producedAt":"2026-07-16T10:14:00Z","expiresAt":"2026-07-16T10:18:00Z","evidence":{"ref":".ai-runs/verify-20260716-level5-completion-e2e-01/commands/verify.e2e/9306ea40-771b-4081-8ce7-55fb995f28b9.json","schema":"ai/schemas/command-result.schema.json","sha256":"b6690a3dc80ad047df39835bdc47389a812ae304c7253aa885ae38a6b93897cd"},"reason":null}
